,Title,URL,Sources,Authors,Keywords,Abstract
27,AstroSat view of LMC X-2: evolution of broad-band X-ray spectral properties along a complete Z-track,https://ui.adsabs.harvard.edu/abs/2020MNRAS.497.3726A,['LMC X-2'],"Agrawal, V. K., & Nandi, A.","accretion, accretion discs, X-rays: binaries, X-rays: individual: LMC X-2, Astrophysics - High Energy Astrophysical Phenomena","In this paper, we report the first results of the extragalactic Z-source Large Magellanic Cloud (LMC) X-2 obtained using the ∼140 ks observations with Large Area X-ray Proportional Counter (LAXPC) and Soft X-ray Telescope (SXT) onboard AstroSat. The Hardness-Intensity Diagram created with the LAXPC data revealed a complete Z-pattern of the source, showing all the three branches. We studied the evolution of the broad-band X-ray spectra in the energy range of 0.5-20.0 keV along the Z-track, a first such study of this source. The X-ray spectra of the different parts of the Z-pattern were well described by an absorbed Comptonized component. An absence of the accretion disc component suggests that the disc is most probably obscured by a Comptonized region. The best fit electron temperature (kT<SUB>e</SUB>) was found to be in the range of 1.7-2.1 keV and optical depth (τ) was found to be in the range of 13.2-17.5. The optical depth (τ) increased as the source moved from the normal/flaring branch (NB/FB) vertex to the upper part of the FB, suggesting a possible outflow triggered by a strong radiation pressure. The power density spectra (PDS) of HB and NB could be fitted with a pure power law of index α∼1.68 and 0.83, respectively. We also found a weak evidence of quasi-periodic oscillation (2.8σ) in the FB. The intrinsic luminosity of the source varied between (1.03-1.79) × 10<SUP>38</SUP> erg s<SUP>-1</SUP>. We discuss our results by comparing with other Z-sources and the previous observations of LMC X-2."
28,AstroSat and MAXI view of the black hole binary 4U 1630-472 during 2016 and 2018 outbursts,https://ui.adsabs.harvard.edu/abs/2020MNRAS.497.1197B,['4U 1630-472'],"Baby, B. E., Agrawal, V. K., Ramadevi, M. C., Katoch, T., Antia, H. M., Mandal, S., & Nandi, A.","accretion, accretion discs, black hole physics, stars: individual: 4U 1630-47, Astrophysics - High Energy Astrophysical Phenomena","We present an in-depth spectral and timing analysis of the black hole binary 4U 1630-472 during 2016 and 2018 outbursts as observed by AstroSat and MAXI. The extensive coverage of the outbursts with MAXI is used to obtain the hardness intensity diagram (HID). The source follows a 'c'-shaped profile in agreement with earlier findings. Based on the HIDs of previous outbursts, we attempt to track the evolution of the source during a 'super'-outburst and 'mini'-outbursts. We model the broad-band energy spectra (0.7-20.0 keV) of AstroSat observations of both outbursts using phenomenological and physical models. No Keplerian disc signature is observed at the beginning of 2016 outburst. However, the disc appears within a few hours after which it remains prominent with temperature (T<SUB>in</SUB>) ∼ 1.3 keV and increase in photon index (Γ) from 1.8 to 2.0, whereas the source was at a disc dominant state throughout the AstroSat campaign of 2018 outburst. Based on the HIDs and spectral properties, we classify the outbursts into three different states - the 'canonical' hard and soft states along with an intermediate state. Evolution of rms along different states is seen although no quasi-periodic oscillations are detected. We fit the observed spectra using a dynamical accretion model and estimate the accretion parameters. Mass of the black hole is estimated using inner disc radius, bolometric luminosity, and two-component flow model to be 3-9 M<SUB>☉</SUB>. Finally, we discuss the possible implications of our findings."
29,Time evolution of cyclotron line of Her X-1: a detailed statistical analysis including new AstroSat data,https://ui.adsabs.harvard.edu/abs/2020MNRAS.497.1029B,"['MJD 55400', 'Her X-1']","Bala, S., Bhattacharya, D., Staubert, R., & Maitra, C.","stars: neutron, stars: pulsars: individual: Her X-1, X-rays: binaries, Astrophysics - High Energy Astrophysical Phenomena","The cyclotron line feature in the X-ray spectrum of the accretion-powered pulsar Her X-1 has been observed and monitored for over three decades. The line energy exhibited a slow secular decline over the period 1995-2014, with a possible (not confirmed) indication of a reversal thereafter. Recent works have shown that the temporal evolution of the line energy may be modelled as a flattening after an earlier decrease until MJD 55400 (±200). In this work, we present the results of AstroSat observations in the context of earlier data and offer a common interpretation through a detailed study of temporal and flux dependence. We find that the variation of the line energy does not support an upward trend but is consistent with the reported flattening after an earlier decrease until MJD $54487^{+515}_{-469}$ ."
30,AstroSat UVIT Detections of Chandra X-Ray Sources in M31,https://ui.adsabs.harvard.edu/abs/2020ApJS..250...23L,['M31'],"Leahy, D. A., & Chen, Y.","Andromeda Galaxy, Ultraviolet sources, X-ray sources, Low-mass x-ray binary stars, Globular star clusters, 39, 1741, 1822, 939, 656, Astrophysics - Astrophysics of Galaxies","An ultraviolet (UV) survey of M31 has been carried out during 2017-19 with the Ultra-Violet Imaging Telescope (UVIT) instrument on board the AstroSat Observatory. Here we match the M31 UVIT source catalog with the Chandra source catalog. We find 67 UVIT/Chandra sources detected in a varying number of UV and X-ray bands. The UV and X-ray photometry is analyzed using power-law and blackbody models. The X-ray types include 15 low-mass X-ray binaries (LMXBs) and five active galactic nuclei. Crossmatches with catalogs of stars, clusters, and other source types yield the following: 20 of the UVIT/Chandra sources match with M31 globular clusters, and nine with foreground stars. Three more globular clusters and two more foreground stars are consistent with the UVIT source positions although outside the Chandra match radius of 1″. The UV emission of the UVIT/Chandra sources associated with globular clusters is consistent with emission from blue horizontal branch stars rather than from the X-ray source. The LMXBs in globular clusters are among the most luminous globular clusters in M31. Comparison with stellar evolutionary tracks shows that the UVIT/Chandra sources with high UV blackbody temperatures are consistent with massive (10-30 M<SUB>⊙</SUB>) stars in M31."
31,An underlying clock in the extreme flip-flop state transitions of the black hole transient Swift J1658.2-4242,https://ui.adsabs.harvard.edu/abs/2020A&A...641A.101B,['Swift J1658.2-4242'],"Bogensberger, D., Ponti, G., Jin, C., Belloni, T. M., Pan, H., Nandra, K., Russell, T. D., Miller-Jones, J. C. A., Muñoz-Darias, T., Vynatheya, P., & Vincentelli, F.","accretion, accretion disks, black hole physics, X-rays: binaries, time, Astrophysics - High Energy Astrophysical Phenomena",
32,Study of recent outburst in the Be/X-ray binary RX J0209.6-7427 with AstroSat: a new ultraluminous X-ray pulsar in the Magellanic Bridge?,https://ui.adsabs.harvard.edu/abs/2020MNRAS.495.2664C,['RX J0209.6-7427'],"Chandra, A. D., Roy, J., Agrawal, P. C., & Choudhury, M.","stars: emission-line, Be, stars: neutron, pulsars: individual: RX J0209.6-7427, galaxies: individual: SMC, X-rays: binaries, X-rays: bursts, Astrophysics - High Energy Astrophysical Phenomena","We present the timing and spectral studies of RX J0209.6-7427 during its rare 2019 outburst using observations with the Soft X-ray Telescope (SXT) and Large Area X-ray Proportional Counter (LAXPC) instruments on the AstroSat satellite. Pulsations having a periodicity of 9.29 s were detected for the first time by the NICER mission in the 0.2-10 keV energy band and, as reported here, by AstroSat over a broad energy band covering 0.3-80 keV. The pulsar exhibits a rapid spin-up during the outburst. Energy resolved folded pulse profiles are generated in several energy bands in 3-80 keV. To the best of our knowledge this is the first report of the timing and spectral characteristics of this Be binary pulsar in hard X-rays. There is suggestion of evolution of the pulse profile with energy. The energy spectrum of the pulsar is determined and from the best-fitting spectral values, the X-ray luminosity of RX J0209.6-7427 is inferred to be 1.6 × 10<SUP>39</SUP> erg s<SUP>-1</SUP>. Our timing and spectral studies suggest that this source has features of an ultraluminous X-ray pulsar in the Magellanic Bridge. Details of the results are presented and discussed in terms of the current ideas."
33,AstroSat Observations of GRO J2058+42 during the 2019 Outburst,https://ui.adsabs.harvard.edu/abs/2020ApJ...897...73M,['GRO J2058+42'],"Mukerjee, K., Antia, H. M., & Katoch, T.","1822, 733, 1108, 142, 153, Astrophysics - High Energy Astrophysical Phenomena","We present results from AstroSat observations of the recent outburst of GRO J2058+42, an X-ray pulsar in a Be-binary system. The source was observed by the LAXPC and SXT instruments on AstroSat on 2019 April 10 during the declining phase of its latest giant outburst. Light curves showed a strong pulsation of the pulsar with a period of 194.2201 ± 0.0016 s and a spin-up rate of (1.65 ± 0.06) × 10<SUP>-11</SUP> Hz s<SUP>-1</SUP>. Intermittent flaring was detected in light curves between the 3 and 80 keV energy bands, with an increase in intensity of up to 1.8 times its average intensity. Pulse profiles obtained between the 3 and 80 keV energy bands of the pulsar showed strong dependence on energy. During AstroSat observations, a broad peak was consistently observed in the power density spectrum of the source with a peak oscillation frequency of 0.090 Hz along with its higher harmonics, which may be due to quasi-periodic oscillations, a commonly observed phenomenon in transient X-ray pulsars during their outburst. AstroSat observations also detected cyclotron absorption features in its spectrum corresponding to (9.7-14.4) keV, (19.3-23.8) keV, and (37.8-43.1) keV. The pulse-phase-resolved spectroscopy of the source showed a phase-dependent variation in its energy and the relative strength of these features. The spectrum was well fitted with an absorbed blackbody, Fermi-Dirac cutoff model and alternatively with an absorbed CompTT model. Both of these models were combined with an Fe line and three Gaussian absorption lines to account for the observed cyclotron resonance scattering features in the spectrum."
34,Blazar Variability: A Study of Nonstationarity and the Flux-Rms Relation,https://ui.adsabs.harvard.edu/abs/2020ApJ...897...25B,"['3C 273', 'PKS 2155-304', 'Mrk 421']","Bhattacharyya, S., Ghosh, R., Chatterjee, R., & Das, N.","1810, 164, 2035, Astrophysics - High Energy Astrophysical Phenomena, Astrophysics - Astrophysics of Galaxies","We analyze X-ray light curves of the blazars Mrk 421, PKS 2155-304, and 3C 273 using observations by the Soft X-ray Telescope on board AstroSat and archival XMM-Newton data. We use light curves of length 30-90 ks from three to four epochs for all three blazars. We apply the autoregressive integrated moving average model, which indicates the variability is consistent with short memory processes for most of the epochs. We show that the power spectral density (PSDs) of the X-ray variabilities of the individual blazars are consistent within uncertainties across the epochs. This implies that the construction of broadband PSD using light curves from different epochs is accurate. However, using certain properties of the variance of the light curves and its segments, we show that the blazars exhibit hints of nonstationarity beyond that due to their characteristic red-noise nature in some of those observations. We find a linear relationship between the root-mean-squared amplitude of variability at shorter timescales and the mean flux level at longer timescales for light curves of Mrk 421 across epochs separated by decades as well as light curves spanning 5 days and ∼10 yr. The presence of a flux-rms relation over very different timescales may imply that, similar to the X-ray binaries and Seyfert galaxies, longer and shorter timescale variabilities are connected in blazars."
35,Detection of thermonuclear X-ray bursts and dips from the X-ray binary 4U 1323-62 with AstroSat/LAXPC,https://ui.adsabs.harvard.edu/abs/2020RAA....20...98B,['4U 1323-62'],"Bhulla, Y., Roy, J., & Jaaffrey, S. N. A.","accretion disc, individual: 4U 1323-62, stars: neutron star, X-rays: binaries, X-rays: thermonuclear bursts, 14, Astrophysics - High Energy Astrophysical Phenomena","Using data from the Large Area X-ray Proportional Counter (LAXPC) on the AstroSat satellite, we observed Type-1 thermonuclear X-ray bursts from the low mass X-ray binary neutron star 4U 1323-62. Observations of 4U 1323-62 that were carried out during the performance verification phase of the AstroSat satellite indicated six thermonuclear X-ray bursts in a total effective exposure of ∼49.5 ks for about two consecutive days. Recurrence time of the detected thermonuclear bursts is in accordance with the orbital period of the source, ∼9400 s. Moreover, the light curve of 4U 1323-62 revealed the presence of two dips. We present the results from time-resolved spectroscopy performed during all of the six X-ray bursts and also report the detection of a known low frequency quasi-periodic oscillation (LFQPO) at ∼1 Hz from the source. However, any evidence of kilohertz QPO was not found. We have shown the burst profile at different energy ranges. Assuming a distance of 10 kpc, we observed a mean flux of ∼1.8×10<SUP>-9</SUP> erg cm<SUP>2</SUP> s<SUP>-1</SUP>. The radius of the blackbody is found to be highly consistent with the blackbody temperature and the blackbody flux of the bursts."
36,"Isolation, nucleotide sequencing and genomic comparison of a Novel SXT/R391 ICE mobile genetic element isolated from a municipal wastewater environment",https://ui.adsabs.harvard.edu/abs/2020NatSR..10.8716S,[],"Slattery, S., Tony Pembroke, J., Murnane, J. G., & Ryan, M. P.",,"Integrative Conjugative Elements (ICE's) of the SXT/R391 family have largely been detected in clinical or environmental isolates of Gammaproteobacteria, particularly Vibrio and Proteus species. As wastewater treatment plants accumulate a large and diverse number of such species, we examined raw water samples taken from a municipal wastewater treatment plant initially using SXT/R391 family integrase gene-specific PCR probes to detect the presence of such elements in a directed approach. A positive amplification occurred over a full year period and a subsequent Restriction Fragment Length Polymorphism (RFLP) analysis revealed a very limited diversity in the treatment plant examined. Samples demonstrating positive amplification were cultured using Vibrio and Proteus selective media and PCR amplification tracking was utilized to monitor SXT/R391-ICE family containing strains. This screening procedure resulted in the isolation and identification of a Proteus mirabilis strain harbouring an ICE. Whole-genome sequencing of this ICE containing strain using Illumina sequencing technology revealed a novel 81 kb element that contained 75 open reading frames on annotation but contained no antibiotic or metal resistance determinants. Comparative genomics revealed the element contained a conserved ICE core with one of the insertions containing a novel bacteriophage defence mechanism. This directed isolation suggests that ICE elements are present in the environment without apparent selective pressure but may contain adaptive functions allowing survival in particular environments such as municipal wastewater which are reservoirs for large bacterial phage populations."
37,Spectropolarimetric analysis of prompt emission of GRB 160325A: jet with evolving environment of internal shocks,https://ui.adsabs.harvard.edu/abs/2020MNRAS.493.5218S,['GRB 160325'],"Sharma, V., Iyyani, S., Bhattacharya, D., Chattopadhyay, T., Vadawale, S. V., & Bhalerao, V. B.","polarization, radiation mechanisms: non-thermal, radiation mechanisms: thermal, gamma-ray burst: individual (GRB 160325A), Astrophysics - High Energy Astrophysical Phenomena","GRB 160325A is the only bright burst detected by AstroSat CZT Imager in its primary field of view to date. In this work, we present the spectral and polarimetric analysis of the prompt emission of the burst using AstroSat, Fermi, and Niel Gehrels Swift observations. The prompt emission consists of two distinct emission episodes separated by a few seconds of quiescent/ mild activity period. The first emission episode shows a thermal component as well as a low polarization fraction of PF < 37 per cent at 1.5 σ confidence level. On the other hand, the second emission episode shows a non-thermal spectrum and is found to be highly polarized with PF > 43 per cent at 1.5σ confidence level. We also study the afterglow properties of the jet using Swift/XRT data. The observed jet break suggests that the jet is pointed towards the observer and has an opening angle of 1.2° for an assumed redshift, z = 2. With composite modelling of polarization, spectrum of the prompt emission, and the afterglow, we infer that the first episode of emission originates from the photosphere with localized dissipation happening below it, and the second from the optically thin region above the photosphere. The photospheric emission is generated mainly by inverse Compton scattering, whereas the emission in the optically thin region is produced by the synchrotron process. The low radiation efficiency of the burst suggests that the outflow remains baryonic dominated throughout the burst duration with only a subdominant Poynting flux component, and the kinetic energy of the jet is likely dissipated via internal shocks which evolves from an optically thick to optically thin environment within the jet."
38,Possible detection of a new cyclotron feature in 4U 1700-37,https://ui.adsabs.harvard.edu/abs/2020MNRAS.493.3045B,['4U 1700-37'],"Bala, S., Roy, J., & Bhattacharya, D.","magnetic field, binaries: eclipsing, stars: individual: 4U 1700-37, Astrophysics - High Energy Astrophysical Phenomena",We present a spectral and timing study of the high-mass X-ray binary transient source 4U 1700-37 using NuSTAR and ASTROSAT/LAXPC. The source is observed in two different flux states. A combined spectral analysis of NuSTAR's focal plane modules A and B shows the possible hint of a cyclotron line feature at ˜16 keV. The line feature is consistently present in different continuum models with at least 3σ confidence level. We do not detect the presence of a previously reported 39 keV cyclotron line in the combined spectra. A ˜16 keV cyclotron feature would suggest that the compact object is a neutron star with a magnetic field strength ˜2.1 × 10<SUP>12</SUP> G in the emission region. We also find the presence of a rare Ni Kα emission line around 7.6 keV in the NuSTAR spectrum. We searched the NuSTAR and ASTROSAT data for coherent or quasi-periodic oscillation signals but found no evidence in the frequency range 0.1 mHz to 10<SUP>3</SUP> Hz.
39,AstroSat UVIT Survey of M31: Point-source Catalog,https://ui.adsabs.harvard.edu/abs/2020ApJS..247...47L,['M31'],"Leahy, D. A., Postma, J., Chen, Y., & Buick, M.","1736, 1741, 39","An ultraviolet survey of M31 has been carried out during 2017-19 with the UltraViolet Imaging Telescope (UVIT) instrument on board the AstroSat Observatory. Here we analyze far- and near-ultraviolet (FUV and NUV) observations from the M31 UVIT survey, which covers a sky area of ≃3° × 1° with spatial resolution of ≃1″. The observations included six filter bands in the wavelength range of 120-280 nm. The limiting magnitude (AB) in the FUV band (CaF2 filter), which has the largest number of detected sources, is ∼23. The primary product of this work is the M31 UVIT point-source catalog containing positions and photometry. In total ≃75,000 sources were detected at FUV or NUV wavelengths."
40,Additional Calibration of the Ultraviolet Imaging Telescope on Board AstroSat,https://ui.adsabs.harvard.edu/abs/2020AJ....159..158T,[],"Tandon, S. N., Postma, J., Joseph, P., Devaraj, A., Subramaniam, A., Barve, I. V., George, K., Ghosh, S. K., Girish, V., Hutchings, J. B., Kamath, P. U., Kathiravan, S., Kumar, A., Lancelot, J. P., Leahy, D., Mahesh, P. K., Mohan, R., Nagabhushana, S., Pati, A. K., Rao, N. K., Sankarasubramanian, K., Sriram, S., & Stalin, C. S.","1736, 1743, 799, 1740, 1558, Astrophysics - Instrumentation and Methods for Astrophysics","Results of the initial calibration of the Ultra-Violet Imaging Telescope (UVIT) were reported earlier by Tandon et al. The results reported earlier were based on the ground calibration as well as the first observations in orbit. Some additional data from the ground calibration and data from more in-orbit observations have been used to improve the results. In particular, extensive new data from in-orbit observations have been used to obtain (a) new photometric calibration that includes (i) zero points, (ii) flat fields, and (iii) saturation; (b) sensitivity variations; (c) spectral calibration for the near ultraviolet (NUV; 2000-3000 Å) and far ultraviolet (FUV; 1300-1800 Å) gratings; (d) point-spread function; and (e) astrometric calibration including distortion. Data acquired over the last three years show continued good performance of UVIT with no reduction in sensitivity in both UV channels."
41,A broad-band look of the accreting millisecond X-ray pulsar SAX J1748.9-2021 using AstroSat and XMM-Newton,https://ui.adsabs.harvard.edu/abs/2020MNRAS.492.4361S,"['NGC 6440', 'SAX J1748.9-2021']","Sharma, R., Beri, A., Sanna, A., & Dutta, A.","accretion, accretion discs, stars: neutron, X-rays: binaries, X-rays: bursts, X-rays: individual (SAX J1748.9-2021), Astrophysics - High Energy Astrophysical Phenomena","SAX J1748.9-2021 is a transient accretion powered millisecond X-ray pulsar located in the globular cluster NGC 6440. We report on the spectral and timing analysis of SAX J1748.9-2021 performed on AstroSat data taken during its faint and short outburst of 2017. We derived the best-fitting orbital solution for the 2017 outburst and obtained an average local spin frequency of 442.361098(3) Hz. The pulse profile obtained from 3 to 7 and 7 to 20 keV energy bands suggest constant fractional amplitude ˜0.5 per cent for fundamental component, contrary to previously observed energy pulse profile dependence. Our AstroSat observations revealed the source to be in a hard spectral state. The 1-50 keV spectrum from SXT (Soft X-ray Telescope) and LAXPC (Large Area X-ray Proportional Counter) on-board AstroSat can be well described with a single temperature blackbody and thermal Comptonization. Moreover, we found that the combined spectra from XMM-Newton (EPIC-PN) and AstroSat (SXT + LAXPC) indicated the presence of reflection features in the form of iron (Fe Kα) line that we modelled with the reflection model xillvercp. One of the two X-ray burst observed during the AstroSat/LAXPC observation showed hard X-ray emission (>30 keV) due to Compton up-scattering of thermal photons by the hot corona. Time-resolved analysis performed on the bursts revealed complex evolution in emission radius of blackbody for second burst suggestive of mild photospheric radius expansion."
42,Correction to: AstroSat/LAXPC view of GX 17+2: spectral evolution along the Z-track,https://ui.adsabs.harvard.edu/abs/2020Ap&SS.365...56A,['GX 17+2'],"Agrawal, V. K., Nandi, A., & Ramadevi, M. C.",,In the Discussion section of the initial online publication an incorrect percentage was specified for the observed contribution of the hard X-ray tail in the middle and upper flaring branch to the total flux of 3.0-80.0 keV. The original article has been corrected.
